calculator_name,page_title,meta_description,title_length,meta_description_length,canonical_path,title_has_brand,description_has_brand,title_has_pipe_or_dash,has_h1,h1_text,h1_length,title_equals_h1,has_schema_jsonld,schema_types,has_breadcrumb_schema,has_faq_schema,has_softwareapp_schema,word_count_estimate,issues
Sitemap.xml,,,0,0,,false,false,false,false,,0,false,false,,false,false,false,1040,MISSING_CANONICAL;MISSING_TITLE;MISSING_META_DESCRIPTION;MISSING_H1;MISSING_JSONLD
Privacy Policy,,,0,0,,false,false,false,false,,0,false,false,,false,false,false,0,MISSING_CANONICAL;MISSING_TITLE;MISSING_META_DESCRIPTION;MISSING_H1;MISSING_JSONLD
Calculate How Much,Calculate How Much | Free Online Calculators & Tools,"Quick calculations for everyday numbers. Explore calculator clusters and launch focused tools for math, finance, loans, time, and percentage planning.",52,150,/,true,false,true,true,Calculate How Much,18,false,true,Organization;WebSite;WebPage,false,false,false,22,
All Calculators,All Calculators | Calculate How Much Online Calculator Hub,"Browse every calculator on Calculate How Much, organized by category with direct links to launch each tool and explore related finance or math topics.",58,150,/calculators/,true,true,true,true,All Calculators,15,false,false,,false,false,false,259,MISSING_JSONLD;MISSING_BREADCRUMB_SCHEMA;MISSING_SOFTWAREAPP_SCHEMA;LOW_WORD_COUNT
Auto Loan Comparison Calculator,Auto Loan Comparison Calculator | Compare 2 Loans,"Compare two auto loans by monthly payment, total interest, total paid, and payoff timing to see which offer costs less.",49,119,/car-loan-calculators/auto-loan-calculator/,false,false,true,true,Auto Loan Comparison Calculator,31,false,true,SoftwareApplication;BreadcrumbList,true,false,true,1018,DESC_TOO_SHORT
Car Lease Calculator,"Car Lease Calculator | Payment, Residual & Cost","Estimate car lease payments, residual value, finance charge, and total lease cost using price, money factor, upfront payment, and term.",47,135,/car-loan-calculators/car-lease-calculator/,false,false,true,true,Car Lease Calculator,20,false,true,SoftwareApplication;BreadcrumbList,true,false,true,1074,
Car Loan Calculator,Car Loan Calculator | Monthly Payment & Cost,"Estimate car loan payments, total interest, and total cost using vehicle price, deposit, trade-in, fees, tax, APR, and term.",44,124,/car-loan-calculators/car-loan-calculator/,false,false,true,true,Car Loan Calculator,19,false,true,SoftwareApplication;BreadcrumbList,true,false,true,1034,
Hire Purchase Calculator,Hire Purchase Calculator | Monthly Payment & Cost,"Estimate hire purchase payments, balloon amount, total interest, and total payable using vehicle price, deposit, APR, and term.",49,127,/car-loan-calculators/hire-purchase-calculator/,false,false,true,true,Hire Purchase Calculator,24,false,true,SoftwareApplication;BreadcrumbList,true,false,true,990,
PCP Car Finance Calculator,"PCP Calculator | Monthly Payment, GFV & Cost","Estimate PCP payments, GFV, option fee, total interest, and total payable using price, deposit, APR, and term.",44,110,/car-loan-calculators/pcp-calculator/,false,false,true,true,PCP Car Finance Calculator,26,false,true,SoftwareApplication;BreadcrumbList,true,false,true,1085,DESC_TOO_SHORT
Contact,Contact | Calculate How Much - Feedback and Support,"Reach the Calculate How Much team for feedback, questions, or support. Learn how to get in touch without sharing personal email addresses or mailto links.",51,154,/contact-us/,true,true,true,true,Contact,7,false,false,,false,false,false,68,MISSING_JSONLD
Balance Transfer Credit Card Calculator,"Balance Transfer Calculator | Fees, Promo APR & Savings","Compare transfer fee, promo months, post-promo APR, payoff time, and total cost to see whether a balance transfer saves money.",55,126,/credit-card-calculators/balance-transfer-credit-card-calculator/,false,false,true,true,Balance Transfer Credit Card Calculator,39,false,true,SoftwareApplication;BreadcrumbList,true,false,true,1161,
Credit Card Consolidation Calculator,Credit Card Consolidation Calculator | Loan vs Cards,"Compare card repayment versus a consolidation loan by monthly payment, payoff time, fees, total interest, and total repaid.",52,123,/credit-card-calculators/credit-card-consolidation-calculator/,false,false,true,true,Credit Card Consolidation Calculator,36,false,true,SoftwareApplication;BreadcrumbList,true,false,true,2284,
Credit Card Minimum Payment Calculator,Credit Card Minimum Payment Calculator | Payoff Cost,"See how long minimum-only credit card payments take, what your first payment may be, and how much interest you could pay overall.",52,129,/credit-card-calculators/credit-card-minimum-payment-calculator/,false,false,true,true,Credit Card Minimum Payment Calculator,38,false,true,SoftwareApplication;BreadcrumbList,true,false,true,1251,
Credit Card Payment Calculator,Credit Card Payment Calculator | Payoff & Interest,"Estimate credit card payoff time, monthly payment impact, total interest, and total repaid from your balance, APR, and payment plan.",50,132,/credit-card-calculators/credit-card-payment-calculator/,false,false,true,true,Credit Card Payment Calculator,30,false,true,SoftwareApplication;BreadcrumbList,true,false,true,1394,
FAQs,FAQs | Calculate How Much - Calculator Help and Answers,"Find answers about how Calculate How Much calculators work, data assumptions, accuracy, and when to verify results with professionals for important decisions.",55,158,/faq/,true,true,true,true,FAQs,4,false,true,FAQPage,false,true,false,737,
Compound Interest Calculator,Compound Interest Calculator | Ending Balance & Growth,"Estimate ending balance, total contributions, and compound growth using starting amount, rate, time, and compounding.",54,117,/finance-calculators/compound-interest-calculator/,false,false,true,true,Compound Interest Calculator,28,false,true,WebSite;Organization;WebPage;SoftwareApplication;FAQPage;BreadcrumbList,true,true,true,900,DESC_TOO_SHORT
Effective Annual Rate Calculator,Effective Annual Rate Calculator | True Annual Rate,Estimate the effective annual rate from a nominal rate and compounding frequency to compare the true yearly cost or return.,51,123,/finance-calculators/effective-annual-rate-calculator/,false,false,true,true,Effective Annual Rate Calculator,32,false,true,WebSite;Organization;WebPage;SoftwareApplication;FAQPage;BreadcrumbList,true,true,true,792,
Future Value Calculator,Future Value Calculator | Growth Over Time,"Estimate the future value of money using starting amount, rate, time period, compounding, and optional recurring contributions.",42,127,/finance-calculators/future-value-calculator/,false,false,true,true,Future Value Calculator,23,false,true,WebSite;Organization;WebPage;SoftwareApplication;FAQPage;BreadcrumbList,true,true,true,755,
Future Value of Annuity Calculator,Future Value of Annuity Calculator | Ordinary or Due,"Estimate the future value of an annuity using payment amount, growth rate, periods, and annuity timing.",52,103,/finance-calculators/future-value-of-annuity-calculator/,false,false,true,true,Future Value of Annuity Calculator,34,false,true,WebSite;Organization;WebPage;SoftwareApplication;FAQPage;BreadcrumbList,true,true,true,916,DESC_TOO_SHORT
Investment Growth Calculator,Investment Growth Calculator | Future Value Projection,"Estimate future value, total contributions, and total gains using return rate, time horizon, and optional inflation adjustment.",54,127,/finance-calculators/investment-growth-calculator/,false,false,true,true,Investment Growth Calculator,28,false,true,WebSite;Organization;WebPage;SoftwareApplication;FAQPage;BreadcrumbList,true,true,true,676,
Investment Return Calculator,"Investment Return Calculator | CAGR, Profit & Growth","Estimate investment return, portfolio growth, profit, and CAGR using lump sums, contributions, inflation, and tax settings.",52,123,/finance-calculators/investment-return-calculator/,false,false,true,true,Investment Return Calculator,28,false,true,WebSite;Organization;WebPage;SoftwareApplication;FAQPage;BreadcrumbList,true,true,true,1596,
Monthly Savings Needed Calculator,Monthly Savings Needed Calculator | Reach Your Goal,"Estimate the monthly savings needed to reach a goal using current balance, time horizon, interest rate, and compounding.",51,120,/finance-calculators/monthly-savings-needed-calculator/,false,false,true,true,Monthly Savings Needed Calculator,33,false,true,WebSite;Organization;WebPage;SoftwareApplication;FAQPage;BreadcrumbList,true,true,true,922,
Present Value Calculator,Present Value Calculator | Discount Future Money,"Estimate the present value of future money using discount rate, time period, and compounding frequency.",48,103,/finance-calculators/present-value-calculator/,false,false,true,true,Present Value Calculator,24,false,true,WebSite;Organization;WebPage;SoftwareApplication;FAQPage;BreadcrumbList,true,true,true,742,DESC_TOO_SHORT
Present Value of Annuity Calculator,Present Value of Annuity Calculator | Ordinary or Due,"Estimate the present value of an annuity using payment amount, discount rate, periods, and annuity timing.",53,106,/finance-calculators/present-value-of-annuity-calculator/,false,false,true,true,Present Value of Annuity Calculator,35,false,true,WebSite;Organization;WebPage;SoftwareApplication;FAQPage;BreadcrumbList,true,true,true,783,DESC_TOO_SHORT
Simple Interest Calculator,Simple Interest Calculator | Interest & Final Amount,"Estimate simple interest, total interest, and ending amount using principal, rate, and time period.",52,99,/finance-calculators/simple-interest-calculator/,false,false,true,true,Simple Interest Calculator,26,false,true,WebSite;Organization;WebPage;SoftwareApplication;FAQPage;BreadcrumbList,true,true,true,814,DESC_TOO_SHORT
Time to Savings Goal Calculator,Time to Savings Goal Calculator | Reach Your Target,"Estimate how long it could take to reach a savings goal using current balance, contributions, interest rate, and compounding.",51,125,/finance-calculators/time-to-savings-goal-calculator/,false,false,true,true,Time to Savings Goal Calculator,31,false,true,WebSite;Organization;WebPage;SoftwareApplication;FAQPage;BreadcrumbList,true,true,true,884,
Buy-to-Let Calculator,"Buy-to-Let (Yield, Cashflow & Coverage) | CalcHowMuch","Estimate buy-to-let yield, cashflow, and stress coverage using rent, property price, deposit, rate, and mortgage type inputs.",53,125,/loan-calculators/buy-to-let-mortgage-calculator/,true,false,true,true,Buy-to-Let Calculator,21,false,true,WebSite;Organization;WebPage;SoftwareApplication;FAQPage;BreadcrumbList,true,true,true,1006,
How Much Can I Borrow Calculator,How Much Can I Borrow | Mortgage Affordability | CalcHowMuch,"Estimate your maximum mortgage borrowing using income multiples or payment-to-income checks, then compare monthly payments and total property budget.",60,149,/loan-calculators/how-much-can-i-borrow/,true,false,true,true,How Much Can I Borrow Calculator,32,false,true,WebSite;Organization;WebPage;SoftwareApplication;FAQPage;BreadcrumbList,true,true,true,1518,
Interest Rate Change Calculator,Interest Rate Change Calculator | Rate Impact | CalcHowMuch,"Compare current and new mortgage rates to estimate monthly payment differences, total interest impact, and scenario timing over your remaining term.",59,148,/loan-calculators/interest-rate-change-calculator/,true,false,true,true,Interest Rate Change Calculator,31,false,true,WebSite;Organization;WebPage;SoftwareApplication;FAQPage;BreadcrumbList,true,true,true,2375,
Loan-to-Value (LTV) Calculator,Loan-to-Value (LTV) Calculator | LTV Bands | CalcHowMuch,"Calculate mortgage loan-to-value instantly using property value and either loan amount or deposit, then view risk bands and target LTV levels.",56,142,/loan-calculators/ltv-calculator/,true,false,true,true,Loan-to-Value (LTV) Calculator,30,false,true,WebSite;Organization;WebPage;SoftwareApplication;FAQPage;BreadcrumbList,true,true,true,2518,
Home Loan Calculator,Home Loan Calculator | Mortgage Payment Planner | CalcHowMuch,"Estimate monthly mortgage payments, amortization, payoff timeline, and interest savings from extra payments with our free Home Loan Calculator.",61,143,/loan-calculators/mortgage-calculator/,true,false,true,true,Home Loan Calculator,20,false,true,WebSite;Organization;WebPage;SoftwareApplication;FAQPage;BreadcrumbList,true,true,true,2133,TITLE_TOO_LONG
Offset Calculator,Offset Calculator | Interest Savings & Payoff | CalcHowMuch,"See how offset savings balances and monthly contributions reduce mortgage interest, shorten payoff time, and improve total cost over monthly and yearly views.",59,158,/loan-calculators/offset-mortgage-calculator/,true,false,true,true,Offset Calculator,17,false,true,WebSite;Organization;WebPage;SoftwareApplication;FAQPage;BreadcrumbList,true,true,true,2041,
Personal Loan Calculator,"Personal Loan Calculator - Monthly Payment, Interest & Total Cost | CalcHowMuch","Calculate personal loan monthly payments, total interest, and payoff time. Add extra monthly payments to see interest savings and early payoff.",79,143,/loan-calculators/personal-loan-calculator/,true,false,true,true,Personal Loan Calculator,24,false,true,WebSite;Organization;WebPage;SoftwareApplication;FAQPage;BreadcrumbList,true,true,true,1349,TITLE_TOO_LONG
Remortgage Calculator (Switching),Remortgage Calculator (Switching) | Break-even | CalcHowMuch,"Compare your current mortgage with a new rate and term to see monthly savings, break-even month, and total savings over a 2 to 10 year horizon.",60,143,/loan-calculators/remortgage-calculator/,true,false,true,true,Remortgage Calculator (Switching),33,false,true,WebSite;Organization;WebPage;SoftwareApplication;FAQPage;BreadcrumbList,true,true,true,1154,
Factoring Calculator,Factoring Calculator | Polynomial Factoring Steps | CalcHowMuch,"Factor algebraic expressions using GCF, quadratic factoring, difference of squares, cubes, and grouping with readable result steps.",63,131,/math/algebra/factoring/,true,false,true,true,Factoring Calculator,20,false,true,FAQPage,false,true,false,444,TITLE_TOO_LONG
Polynomial Operations Calculator,Polynomial Operations Calculator | Add Subtract Multiply Divide,"Perform polynomial addition, subtraction, multiplication, and division with quotient and remainder outputs and clear operation summaries.",63,137,/math/algebra/polynomial-operations/,false,false,true,true,Polynomial Operations Calculator,32,false,true,FAQPage,false,true,false,418,TITLE_TOO_LONG
Quadratic Equation Solver,Quadratic Equation Solver Calculator | CalcHowMuch,"Solve quadratic equations of the form ax² + bx + c = 0 with real or complex roots, discriminant details, and step-by-step output.",50,129,/math/algebra/quadratic-equation/,true,false,true,true,Quadratic Equation Solver,25,false,true,FAQPage,false,true,false,402,
Slope and Distance Calculator,Slope and Distance Calculator | CalcHowMuch,"Calculate slope, midpoint, distance, and line equations from two points with clear outputs for vertical, horizontal, and diagonal lines.",43,136,/math/algebra/slope-distance/,true,false,true,true,Slope and Distance Calculator,29,false,true,FAQPage,false,true,false,410,
System of Equations Solver,System of Equations Solver | 2x2 and 3x3 | CalcHowMuch,"Solve 2x2 and 3x3 linear systems using elimination, substitution, and matrix methods with unique/no-solution diagnostics.",54,121,/math/algebra/system-of-equations/,true,false,true,true,System of Equations Solver,26,false,true,FAQPage,false,true,false,413,
Basic Calculator,Basic Calculator | Calculate How Much Online Calculator,"Basic Calculator calculator with fast inputs and clear results. Calculate How Much provides explanations, examples, and assumptions to help you plan confidently.",55,161,/math/basic/,true,true,true,true,Basic Calculator,16,false,false,,false,false,false,187,DESC_TOO_LONG;MISSING_JSONLD
Critical Points Finder,Critical Points Finder | Calculate How Much Online Calculator,"Critical Points Finder calculator with fast inputs and clear results. Calculate How Much provides explanations, examples, and assumptions to help you plan confidently.",61,167,/math/calculus/critical-points/,true,true,true,true,Critical Points Finder,22,false,false,,false,false,false,682,TITLE_TOO_LONG;DESC_TOO_LONG;MISSING_JSONLD
Derivative Calculator,Derivative Calculator | Calculate How Much Online Calculator,"Derivative Calculator calculator with fast inputs and clear results. Calculate How Much provides explanations, examples, and assumptions to help you plan confidently.",60,166,/math/calculus/derivative/,true,true,true,true,Derivative Calculator,21,false,false,,false,false,false,565,DESC_TOO_LONG;MISSING_JSONLD
Integral Calculator,Integral Calculator | Calculate How Much Online Calculator,"Integral Calculator calculator with fast inputs and clear results. Calculate How Much provides explanations, examples, and assumptions to help you plan confidently.",58,164,/math/calculus/integral/,true,true,true,true,Integral Calculator,19,false,false,,false,false,false,578,DESC_TOO_LONG;MISSING_JSONLD
Limit Calculator,Limit Calculator | Calculate How Much Online Calculator,"Limit Calculator calculator with fast inputs and clear results. Calculate How Much provides explanations, examples, and assumptions to help you plan confidently.",55,161,/math/calculus/limit/,true,true,true,true,Limit Calculator,16,false,false,,false,false,false,730,DESC_TOO_LONG;MISSING_JSONLD
Series Convergence Calculator,Series Convergence Calculator | Calculate How Much Online Calculator,"Series Convergence Calculator calculator with fast inputs and clear results. Calculate How Much provides explanations, examples, and assumptions to help you plan confidently.",68,174,/math/calculus/series-convergence/,true,true,true,true,Series Convergence Calculator,29,false,false,,false,false,false,585,TITLE_TOO_LONG;DESC_TOO_LONG;MISSING_JSONLD
Confidence Interval Calculator,Confidence Interval Calculator | Calculate How Much Online Calculator,"Confidence Interval Calculator calculator with fast inputs and clear results. Calculate How Much provides explanations, examples, and assumptions to help you plan confidently.",69,175,/math/confidence-interval/,true,true,true,true,Confidence Interval Calculator,30,false,false,,false,false,false,524,TITLE_TOO_LONG;DESC_TOO_LONG;MISSING_JSONLD
Fraction Calculator,"Fraction Calculator - Add, Subtract, Multiply, Divide & Simplify | CalcHowMuch","Use this free fraction calculator to add, subtract, multiply, divide, simplify, and convert fractions with clear worked steps for students.",78,139,/math/fraction-calculator/,true,false,true,true,Fraction Calculator,19,false,true,SoftwareApplication;BreadcrumbList,true,false,true,694,TITLE_TOO_LONG
Common Log Calculator,Common Log Calculator | Calculate How Much Online Calculator,"Common Log Calculator calculator with fast inputs and clear results. Calculate How Much provides explanations, examples, and assumptions to help you plan confidently.",60,166,/math/log/common-log/,true,true,true,true,Common Log Calculator,21,false,false,,false,false,false,207,DESC_TOO_LONG;MISSING_JSONLD
Exponential Equations Solver,Exponential Equations Solver | Calculate How Much Online Calculator,"Exponential Equations Solver calculator with fast inputs and clear results. Calculate How Much provides explanations, examples, and assumptions to help you plan confidently.",67,173,/math/log/exponential-equations/,true,true,true,true,Exponential Equations Solver,28,false,false,,false,false,false,209,TITLE_TOO_LONG;DESC_TOO_LONG;MISSING_JSONLD
Logarithm Properties,Logarithm Properties | Calculate How Much Online Calculator,"Logarithm Properties calculator with fast inputs and clear results. Calculate How Much provides explanations, examples, and assumptions to help you plan confidently.",59,165,/math/log/log-properties/,true,true,true,true,Logarithm Properties,20,false,false,,false,false,false,186,DESC_TOO_LONG;MISSING_JSONLD
Log Scale Converter,Log Scale Converter | Calculate How Much Online Calculator,"Log Scale Converter calculator with fast inputs and clear results. Calculate How Much provides explanations, examples, and assumptions to help you plan confidently.",58,164,/math/log/log-scale/,true,true,true,true,Log Scale Converter,19,false,false,,false,false,false,192,DESC_TOO_LONG;MISSING_JSONLD
Natural Log Calculator,Natural Log Calculator | Calculate How Much Online Calculator,"Natural Log Calculator calculator with fast inputs and clear results. Calculate How Much provides explanations, examples, and assumptions to help you plan confidently.",61,167,/math/log/natural-log/,true,true,true,true,Natural Log Calculator,22,false,false,,false,false,false,230,TITLE_TOO_LONG;DESC_TOO_LONG;MISSING_JSONLD
Mean Median Mode Range Calculator,Mean Median Mode Range Calculator | Calculate How Much Online Calculator,"Mean Median Mode Range Calculator calculator with fast inputs and clear results. Calculate How Much provides explanations, examples, and assumptions to help you plan confidently.",72,178,/math/mean-median-mode-range/,true,true,true,true,Mean Median Mode Range Calculator,33,false,false,,false,false,false,456,TITLE_TOO_LONG;DESC_TOO_LONG;MISSING_JSONLD
Number Sequence Calculator,Number Sequence Calculator | Calculate How Much Online Calculator,"Number Sequence Calculator calculator with fast inputs and clear results. Calculate How Much provides explanations, examples, and assumptions to help you plan confidently.",65,171,/math/number-sequence/,true,true,true,true,Number Sequence Calculator,26,false,false,,false,false,false,456,TITLE_TOO_LONG;DESC_TOO_LONG;MISSING_JSONLD
Permutation & Combination Calculator,Permutation & Combination Calculator | Calculate How Much Online Calculator,"Permutation & Combination Calculator calculator with fast inputs and clear results. Calculate How Much provides explanations, examples, and assumptions to help you plan confidently.",75,181,/math/permutation-combination/,true,true,true,true,Permutation & Combination Calculator,36,false,false,,false,false,false,437,TITLE_TOO_LONG;DESC_TOO_LONG;MISSING_JSONLD
Probability Calculator,Probability Calculator | Calculate How Much Online Calculator,"Probability Calculator calculator with fast inputs and clear results. Calculate How Much provides explanations, examples, and assumptions to help you plan confidently.",61,167,/math/probability/,true,true,true,true,Probability Calculator,22,false,false,,false,false,false,620,TITLE_TOO_LONG;DESC_TOO_LONG;MISSING_JSONLD
Sample Size,Sample Size | Calculate How Much Online Calculator,"Sample Size calculator with fast inputs and clear results. Calculate How Much provides explanations, examples, and assumptions to help you plan confidently.",50,156,/math/sample-size/,true,true,true,true,Sample Size,11,false,true,WebPage;SoftwareApplication;BreadcrumbList;FAQPage,true,true,true,1763,
Standard Deviation Calculator,Standard Deviation Calculator | Calculate How Much Online Calculator,"Standard Deviation Calculator calculator with fast inputs and clear results. Calculate How Much provides explanations, examples, and assumptions to help you plan confidently.",68,174,/math/standard-deviation/,true,true,true,true,Standard Deviation Calculator,29,false,false,,false,false,false,422,TITLE_TOO_LONG;DESC_TOO_LONG;MISSING_JSONLD
Statistics Calculator,Statistics Calculator | Calculate How Much Online Calculator,"Statistics Calculator calculator with fast inputs and clear results. Calculate How Much provides explanations, examples, and assumptions to help you plan confidently.",60,166,/math/statistics/,true,true,true,true,Statistics Calculator,21,false,false,,false,false,false,452,DESC_TOO_LONG;MISSING_JSONLD
ANOVA Calculator,ANOVA Calculator | Calculate How Much Online Calculator,"ANOVA Calculator calculator with fast inputs and clear results. Calculate How Much provides explanations, examples, and assumptions to help you plan confidently.",55,161,/math/statistics/anova/,true,true,true,true,ANOVA Calculator,16,false,false,,false,false,false,386,DESC_TOO_LONG;MISSING_JSONLD
Correlation Calculator,Correlation Calculator | Calculate How Much Online Calculator,"Correlation Calculator calculator with fast inputs and clear results. Calculate How Much provides explanations, examples, and assumptions to help you plan confidently.",61,167,/math/statistics/correlation/,true,true,true,true,Correlation Calculator,22,false,false,,false,false,false,450,TITLE_TOO_LONG;DESC_TOO_LONG;MISSING_JSONLD
Distribution Calculator,Distribution Calculator | Calculate How Much Online Calculator,"Distribution Calculator calculator with fast inputs and clear results. Calculate How Much provides explanations, examples, and assumptions to help you plan confidently.",62,168,/math/statistics/distribution/,true,true,true,true,Distribution Calculator,23,false,false,,false,false,false,437,TITLE_TOO_LONG;DESC_TOO_LONG;MISSING_JSONLD
Hypothesis Testing,Hypothesis Testing | Calculate How Much Online Calculator,"Hypothesis Testing calculator with fast inputs and clear results. Calculate How Much provides explanations, examples, and assumptions to help you plan confidently.",57,163,/math/statistics/hypothesis-testing/,true,true,true,true,Hypothesis Testing,18,false,false,,false,false,false,453,DESC_TOO_LONG;MISSING_JSONLD
Regression Analysis,Regression Analysis | Calculate How Much Online Calculator,"Regression Analysis calculator with fast inputs and clear results. Calculate How Much provides explanations, examples, and assumptions to help you plan confidently.",58,164,/math/statistics/regression-analysis/,true,true,true,true,Regression Analysis,19,false,false,,false,false,false,407,DESC_TOO_LONG;MISSING_JSONLD
